,event_date,event_state,event_city,event_name,event_location_name,event_address,filtered
755,2017-10-24,CA,Azusa,Azusa High School/Azusa USD College Fair,Azusa High School,240 N Cerritos Ave,
756,2017-10-24,FL,Niceville,Okaloosa and Walton County College Night,Northwest Fl St College,100 College Blvd E,
757,2017-10-24,GA,Clarkston,Clarkston High School College Fair,Clarkston High School,618 N Indian Creek Dr,
758,2017-10-24,GA,Lithonia,Arabia Mountain High School,Arabia Mountain High School,6610 Browns Mill Rd,
759,2017-10-24,GA,Norman Park,PROBE - Colquitt County Fair,Colquitt County High School,105 Darbyshire Rd,
760,2017-10-24,TX,Lucas,Lovejoy High School Visit,Lovejoy High School,2350 Estates Pkwy,
761,2017-10-24,TX,Westlake,Westlake Academy College Day,Westlake Academy,2600 J T Ottinger Rd,
762,2017-10-24,VA,Newport News,Hampton Roads Academy,Hampton Roads Academy,739 Academy Ln,
763,2017-10-24,VA,Norfolk,Norfolk Collegiate,Norfolk Collegiate School,7336 Granby St,
764,2017-10-24,VA,Suffolk,Nansemond-suffolk Academy,Nansemond-Suffolk Academy,3373 Pruden Blvd,
765,2017-10-24,VA,Virginia Bch,Virginia Beach City Public School's College Information Program,Virginia Beach Convention Center,1000 19th St,
766,2017-10-25,CA,Newport Coast,Sage Hill School,Sage Hill School,20402 Newport Coast Dr,
767,2017-10-25,CA,San Juan Capo,JSerra Catholic High School,Jserra Catholic High School,26351 Junipero Serra Rd,
768,2017-10-25,CA,San Juan Capo,San Juan Hills High School,San Juan Hills High School,29211 Stallion Rdg,
769,2017-10-25,DE,Wilmington,Salesianum School,Salesianum School,1801 N Broom St,
770,2017-10-25,GA,Kennesaw,Harrison High School,Harrison High School,4500 Due West Rd NW,
771,2017-10-25,GA,Marietta,Wheeler High School,Wheeler High School,375 Holt Rd NE,
772,2017-10-25,GA,Tifton,PROBE - Tift County Fair,Tift County High School,1 Blue Devil Way,
773,2017-10-25,MD,Annapolis,Broadneck High School College Fair,Broadneck High School,1265 Green Holly Dr,
774,2017-10-25,TX,Fort Worth,TACRAO - R.L Paschal High School College Fair,Robert L Paschal High School,3001 Forest Park Blvd,
775,2017-10-25,TX,Southlake,Carroll ISD College Fair@Carroll Sr. High School,Carroll Senior High School,1501 W Southlake Blvd,1.0
776,2017-10-26,CA,Santa Ana,Mater Dei High School,Mater Dei High School,1202 W Edinger Ave,
777,2017-10-26,CA,Santa Ana,OC School of the Arts Fair,Orange County Sch Of The Arts,1010 N Main St,
778,2017-10-26,CA,Yorba Linda,Placentia-Yorba Linda Unified School District (PYLUSD) College Fair,Yorba Linda Community Center,4501 Casa Loma Ave,
779,2017-10-26,DC,Washington,British School,British School Of Washington,2001 Wisconsin Ave NW,1.0
780,2017-10-26,GA,Decatur,Columbia High School College Fair,Columbia,2106 Columbia Dr,
781,2017-10-26,GA,Macon,College & Career Fest 2017: Pathways to Success,Anderson Conference Center,5171 Eisenhower Pkwy,
782,2017-10-26,GA,Madison,Morgan County High School,Morgan County High School,1231 College Dr,
783,2017-10-26,GA,Perry,Perry High School,Perry High School,1307 North Ave,
784,2017-10-26,IL,Barrington,Barrington High School,Barrington Community High Schl,616 W Main St,
785,2017-10-26,IL,Chicago,"UCAAN Information Session in Chicago with UChicago, Purdue, Georgia Tech, and UGA",Mandel Hall,1131 E 57th St,
786,2017-10-26,IL,Winnetka,New Trier Township High School,New Trier High School,385 Winnetka Ave,1.0
787,2017-10-26,OK,Edmond,Edmond North High School Visit,Edmond North High School,215 W Danforth Rd,
788,2017-10-26,OK,Oklahoma City,Bishop Mcguinness High School Visit,Bishop Mcguinness High School,801 NW 50th St,
789,2017-10-26,OK,Oklahoma City,Casady School Visit,Casady School,9500 N Pennsylvania Ave,
790,2017-10-26,OK,Oklahoma City,Classen School of Advanced Studies Visit,Classen Sch Advanced Studies,1901 N Ellison Ave,
791,2017-10-26,OK,Oklahoma City,Heritage Hall Visit,Heritage Hall,1800 NW 122nd St,
792,2017-10-26,OK,Oklahoma City,Oklahoma School of Science and Math High School Visit,Oklahoma School Of Science And Mathematics,1141 N Lincoln Blvd,1.0
793,2017-10-26,PA,Kennett Sq,Unionville High School,Unionville High School,750 Unionville Rd,
794,2017-10-27,GA,Decatur,DeKalb County School? District? College? Fair,Georgia State University- Perimeter College,3251 Panthersville Rd,
795,2017-10-27,IL,Aurora,Waubonsie Valley High School,Waubonsie Valley High School,2590 Ogden Ave,
796,2017-10-27,IL,Glenview,Glenbrook South High School,Glenbrook South High School,4000 W Lake Ave,
797,2017-10-27,IL,Naperville,Naperville North High School,Naperville North High School,899 N Mill St,
798,2017-10-27,OK,Tulsa,Bishop Kelly Visit,Bishop Kelley High School,3905 S Hudson Ave,1.0
799,2017-10-27,OK,Tulsa,Booker T Washington High School Visit,Booker T Washington HS,1514 E Zion St,
800,2017-10-27,OK,Tulsa,Cascia Hall Preparatory School Visit,Cascia Hall Preparatory School,2520 S Yorktown Ave,
801,2017-10-27,OK,Tulsa,Holland Hall School Visit,Holland Hall School,5666 E 81st St Uppr School,
802,2017-10-28,GA,Marietta,Cathedral of Turner Chapel AME College Fair,Cathedral of Turner Chapel AME Church,492 N Marietta Pkwy NE,
803,2017-10-30,CA,Mission Viejo,CUSD 2017 Fall College Fair@Capistrano Valley High School,Capistrano Valley High School,26301 Via Escolar,
804,2017-10-30,SC,Hilton Head,Hilton Head Preparatory School's College Fair,Hilton Head Preparatory School,8 Fox Grape Rd,
805,2017-10-30,SC,N Charleston,Charleston County Consolidated Afternoon Program - CACRAO,North Charleston Coliseum & Performing Arts Center,5001 Coliseum Dr,
806,2017-10-30,SC,N Charleston,Charleston County Consolidated Morning Fair,North Charleston Coliseum & Performing Arts Center,5001 Coliseum Dr,
807,2017-10-30,TX,Boerne,Boerne ISD TACRAO College Fair,Boerne Samuel V Champion HS,201 Charger Blvd,
808,2017-10-30,TX,San Antonio,Ronald Reagan High School Visit,Ronald Reagan High School,19000 Ronald Reagan,
809,2017-10-30,TX,San Antonio,Saint Mary's School Visit,Saint Marys Hall,9401 Starcrest Dr,
810,2017-10-30,TX,San Antonio,TACRAO - Alamo Heights ISD College Fair,Alamo Heights High School,6900 Broadway St,
811,2017-10-31,GA,Atlanta,Atlanta International School,Atlanta International School,2890 N Fulton Dr NE,
812,2017-10-31,SC,Charleston,James Island Charter High School,James Island Charter HS,1000 Fort Johnson Rd,
813,2017-10-31,SC,Summerville,CACRAO - Ashley Ridge High School College Fair,Ashley Ridge High School,9800 Delemar Hwy,
814,2017-10-31,SC,Summerville,Pinewood Preparatory School,Pinewood Preparatory School,1114 Orangeburg Rd,
815,2017-11-01,CA,Los Angeles,Notre Dame Academy Visit,Notre Dame Academy,2851 Overland Ave,1.0
816,2017-11-01,GA,Atlanta,Georgia Cyber Academy,Georgia Cyber Academy,1745 Phoenix Blvd Ste 100,
817,2017-11-01,GA,Augusta,Academy of Richmond County,Academy Of Richmond County,910 Russell St,
818,2017-11-01,GA,Augusta,John S Davidson Fine Arts School,John S Davidson Fine Arts School,615 12th St,
819,2017-11-01,GA,Conyers,Heritage HS Visit,Heritage High School,2400 Granade Rd SW,
820,2017-11-01,GA,Conyers,Salem HS Visit,Salem High School,3551 Underwood Rd SE,
821,2017-11-01,GA,Covington,PROBE Newton County Fair at Alcovy High School,Alcovy High School,14567 Highway 36,
822,2017-11-01,GA,Evans,Lakeside High School,Lakeside High School,533 Blue Ridge Dr,
823,2017-11-01,GA,Madison,PROBE Morgan County Fair at Morgan County High School,Morgan County High School,1231 College Dr,
824,2017-11-01,GA,Martinez,Augusta Preparatory Day School,Augusta Preparatory Day School,285 Flowing Wells Rd,
825,2017-11-01,MD,Baltimore,Kenwood High School's 10th Annual College Fair,Kenwood High,501 Stemmers Run Rd,
826,2017-11-01,PA,Berwyn,Conestoga High School,Conestoga High School,200 Irish Rd,
827,2017-11-01,SC,Daniel Island,Bishop England High School,Bishop England High School,363 Seven Farms Dr,1.0
828,2017-11-01,SC,Mt Pleasant,CACRAO - Wando High School College Fair,Wando High School,1000 Warrior Way,
829,2017-11-01,SC,Mt Pleasant,Wando High School,Wando High School,1000 Warrior Way,
830,2017-11-02,CA,Aliso Viejo,Aliso Niguel High School,Aliso Niguel High School,28000 Wolverine Way,
831,2017-11-02,CA,Downey,Downey Unifed School District College Fair,Warren High School,8141 De Palma St,
832,2017-11-02,CA,Irvine,Tarbut V'Torah Upper School,Tarbut V Torah Comm Day School,5 Federation Way,
833,2017-11-02,CA,Irvine,Woodbridge High School,Woodbridge High School,2 Meadowbrook,
834,2017-11-02,CA,San Juan Capo,St. Margaret's Episcopal School,Saint Margarets Episcopal Sch,31641 La Novia Ave,
835,2017-11-02,GA,Commerce,PROBE Jackson County Fair at East Jackson High School,East Jackson Comprehensive High School,1435 Hoods Mill Rd,
836,2017-11-02,GA,Decatur,Southwest Dekalb,Southwest Dekalb High School,2863 Kelley Chapel Rd,
837,2017-11-02,GA,Hampton,Dutchtown High School College Fair,Dutchtown High School,149 Mitchell Rd,
838,2017-11-02,GA,Lawrenceville,Archer High School Visit,Archer High School,2255 New Hope Rd,
839,2017-11-02,GA,Lawrenceville,Mountain View High School Visit,Mountain View High School,2351 Sunny Hill Rd,
840,2017-11-02,GA,Lilburn,Parkview High School Visit,Parkview High School,998 Cole Dr SW,
841,2017-11-02,GA,Locust Grove,Locust Grove High School Visit,Locust Grove High School,3275 S Ola Rd,
842,2017-11-02,GA,Snellville,PROBE Gwinnett South Fair at Brookwood High School,Brookwood High School,1255 Dogwood Rd,
843,2017-11-02,NJ,Summit,Summit High School College Night,Summit High School,125 Kent Place Blvd,
844,2017-11-02,PA,Reading,Berks Catholic High School,Berks Catholic High School,955 E Wyomissing Blvd,
845,2017-11-02,SC,Charleston,Ashley Hall,Ashley Hall,172 Rutledge Ave,
846,2017-11-02,SC,Charleston,Porter-Gaud School,Porter-Gaud School,300 Albemarle Rd,
847,2017-11-02,SC,N Charleston,Academic Magnet School,Academic Magnet High School,5109A W Enterprise St,
848,2017-11-03,GA,Hoschton,Mill Creek High School Visit,Mill Creek High School,4400 Braselton Hwy,
849,2017-11-03,GA,Suwanee,North Gwinnett High School Visit,North Gwinnett High School,20 Level Creek Rd,
850,2017-11-03,TX,Allen,Allen High School Counselor Update,Allen High School,300 Rivercrest Blvd,
851,2017-11-06,CA,Los Angeles,New West Charter School,New West Charter School,1905 Armacost Ave,1.0
852,2017-11-06,CA,Tustin,Tustin Unified College Fair,Tustin High School,1171 El Camino Real,
853,2017-11-06,GA,Bellville,Pinewood Christian Academy College Fair,Pinewood Christian Academy,PO Box 7,
854,2017-11-06,PA,Pittsburgh,Fox Chapel Area High School,Fox Chapel Area High School,611 Field Club Rd,
855,2017-11-07,DE,Wilmington,The Tatnall School,The Tatnall School,1501 Barley Mill Rd,1.0
856,2017-11-07,GA,Watkinsville,Oconee County Chamber of Commerce Scholarship Fair,Oconee County Civic Center,2661 Hog Mountain Rd,
857,2017-11-07,PA,Villanova,Academy Of Notre Dame De Namur,Academy Of Notre Dame De Namur,560 Sproul Rd,
858,2017-11-08,CA,Fountain Vly,Fountain Valley High School College Fair,Fountain Valley High School,17816 Bushard St,
859,2017-11-08,CA,Los Angeles,Marymount High School,Marymount High School,10643 W Sunset Blvd,
860,2017-11-08,KY,Lexington,Lafayette Senior High School,Lafayette Senior High School,401 Reed Ln,
861,2017-11-09,CA,Burbank,John Burroughs High School RACC Mini Fair,John Burroughs High School,1920 W Clark Ave,
862,2017-11-09,GA,Newnan,Newnan High School,Newnan High School,190 Lagrange St,
863,2017-11-09,GA,Newnan,Northgate High School,Northgate High School,3220 Fisher Rd,
864,2017-11-09,GA,Norcross,Norcross High School College Fair,Norcross High School,5300 Spalding Dr,
865,2017-11-09,GA,Sharpsburg,East Coweta High School,East Coweta High School,400 Mccollum Sharpsburg Rd,
866,2017-11-09,GA,Sharpsburg,Trinity Christian School,Trinity Christian School,8817 Highway 54,1.0
867,2017-11-09,SC,Greenville,GREEN Charter School,GREEN Charter School,211 Century Dr,
868,2017-11-10,CA,Los Angeles,Brentwood School,Brentwood School,100 S Barrington Pl,
869,2017-11-10,GA,Douglasville,Douglas County High School,Douglas County High School,8705 Campbellton St,
870,2017-11-10,GA,Douglasville,New Manchesters High School,New Manchester High School,4925 Highway 92/166,
871,2017-11-11,MD,Ft Washington,"Alpha Phi Alpha ""Go to High School, Go to College"" College Fair",Southern Regional Technology and Recreation Complex,7007 Bock Rd,
872,2017-11-12,VA,Norfolk,Norfolk Academy Workshop,Norfolk Academy,1585 Wesleyan Dr,
873,2017-11-14,AZ,Goodyear,BASIS Goodyear,BASIS Goodyear,15800 W Sherman St,
874,2017-11-14,GA,Lithonia,"Martin Luther King, Jr. High School College and Career Day",Martin Luther King Jr High Sch,3991 Snapfinger Rd,
875,2017-11-14,NC,Southern Pines,The O'Neal School,The O'Neal School,3300 Airport Rd,
876,2017-11-14,PA,Pittsburgh,Mount Lebanon High School,Mount Lebanon High School,155 Cochran Rd,
877,2017-11-14,TX,Allen,Allen High School College Panel,Allen High School,300 Rivercrest Blvd,
878,2017-11-15,GA,Marietta,Osborne High School Annual College & Military Fair,Robert L Osborne High School,2451 Favor Rd SW,
879,2017-11-15,GA,Rincon,Effingham College & Career Academy,Effingham College & Career Academy,2940 Georgia 21,1.0
880,2017-11-15,GA,Stone Mtn,Redan,Redan High School,5247 Redan Rd,
881,2017-11-15,PA,Allison Park,Hampton High School,Hampton High School,2929 Mccully Rd,
882,2017-11-16,NJ,Westfield,Westfield High School College Night,Westfield High School,550 Dorian Rd,
883,2017-11-17,ID,Boise,Boise High School,Boise High School,1010 W Washington St,
884,2017-11-21,FL,Jacksonville,Englewood High School,Englewood High School,4412 Barnes Rd,
885,2017-11-29,GA,Atlanta,Dr. Ronald E. McNair,Mcnair High School,1804 Bouldercrest Rd SE,
886,2017-12-01,FL,Jacksonville,Robert E. Lee High School,Robert E Lee Senior HS,1200 Mcduff Ave S,
887,2017-12-02,GA,Brookhaven,NSHSS Holiday Event & College Fair,National Society of High School Scholars,1936 N Druid Hills Rd NE,
888,2017-12-13,DC,Washington,"Evening with UGA in Washington, DC",University of Georgia Delta Hall,608 Massachusetts Ave NE,
889,2017-12-13,GA,Atlanta,Dr. Ronald McNair,Mcnair High School,1804 Bouldercrest Rd SE,
