,event_date,event_state,event_city,event_name,event_location_name,event_address,filtered
504,2017-10-02,FL,St Petersburg,Shorecrest Preparatory School,Shorecrest Preparatory School,5101 1st St NE,
505,2017-10-02,FL,Tampa,C. Leon King High School,C Leon King High School,6815 N 56th St,
506,2017-10-02,FL,Tampa,Tampa Preparatory School,Tampa Preparatory School,727 W Cass St,
507,2017-10-02,GA,Atlanta,Atlanta Girls School,Atlanta Girls School,3254 Northside Pkwy NW,
508,2017-10-02,GA,Atlanta,Evening with UGA in Atlanta,The Loudermilk Conference Center,40 Courtland St NE,
509,2017-10-02,GA,Atlanta,PROBE South Fulton Fair at Westlake High School,Westlake High School,2400 Union Rd SW,
510,2017-10-02,GA,Atlanta,Saint Pius X Catholic High School,Saint Pius X Catholic High School,2674 Johnson Rd NE,
511,2017-10-02,GA,Brookhaven,Marist School,Marist School,3790 Ashford Dunwoody Rd NE,
512,2017-10-02,GA,Hampton,Lovejoy HS Visit,Lovejoy High School,1587 Mcdonough Rd,
513,2017-10-02,GA,Jonesboro,Martha Stillwell School of the Arts Visit,Martha Ellen Stilwell School of the Arts,2580 Mount Zion Pkwy,
514,2017-10-02,GA,Mcdonough,PROBE Henry County Fair at Henry County High School,Henry County High School,401 Tomlinson St,
515,2017-10-02,GA,Sylvester,Worth County High School,Worth County High School,406 W King St,
516,2017-10-02,MD,Olney,Our Lady of Good Counsel,Our Lady Of Good Counsel HS,17301 Old Vic Blvd,
517,2017-10-02,NC,Greensboro,Early College at Guilford,Early College At Guilford,5608 W Friendly Ave,
518,2017-10-02,NC,High Point,Westchester Country Day School,Westchester Country Day School,2045 N Old Greensboro Rd,
519,2017-10-02,NC,Lewisville,Forsyth Country Day,Forsyth Country Day School,5501 Shallowford Rd,
520,2017-10-02,NC,Winston Salem,CACRAO - Winston-Salem: Forsyth County Schools,M.C. Benton Jr. Convention Center,301 W 5th St,
521,2017-10-02,NJ,Berkeley Hts,Livingston High School College Fair,Governor Livingston HS,175 Watchung Blvd,
522,2017-10-02,TN,Knoxville,Knoxville Catholic High School 2017 College Fair,Knoxville Catholic High School,9245 Fox Lonas Rd,
523,2017-10-02,TN,Oak Ridge,Oak Ridge High School College Fair,Oak Ridge High School,1450 Oak Ridge Tpke,
524,2017-10-02,TX,Conroe,"Conroe, Montgomery and Willis ISD 2017 College Night",Lone Star Convention Center,9055 Airport Rd,
525,2017-10-03,CA,Beverly Hills,Beverly Hills High School College Connections Fair,Beverly Hills High School,241 S Moreno Dr,
526,2017-10-03,CA,Mission Viejo,Trabuco Hills 2017 High School College Fair,Trabuco Hills High School,27501 Mustang Run,
527,2017-10-03,FL,Tampa,Academy Of The Holy Names,Academy Of The Holy Names,3319 Bayshore Bvld,
528,2017-10-03,FL,Tampa,Berkeley Preparatory School,Berkeley Preparatory School,4811 Kelly Rd,1.0
529,2017-10-03,FL,Tampa,"Evening with UGA - Tampa, FL",Tampa Preparatory School,727 W Cass St,
530,2017-10-03,FL,Tampa,H. B. Plant High School,H B Plant High School,2415 S Himes Ave,
531,2017-10-03,FL,Tampa,Jesuit High School,Jesuit High School,4701 N Himes Ave,
532,2017-10-03,FL,Tampa,T R Robinson High School,T R Robinson High School,6311 S Lois Ave,
533,2017-10-03,GA,Atlanta,Benjamin E. Mays High School,Benjamin E Mays High School,3450 Benjamin E Mays Dr SW,
534,2017-10-03,GA,Atlanta,D.M. Therrell High School,D M Therrell High School,3099 Panther Trl SW,
535,2017-10-03,GA,Atlanta,KIPP Atlanta Collegiate HS,Kipp Atlanta Collegiate,98 Anderson Ave NW,
536,2017-10-03,GA,Mcdonough,Eagle's Landing HS Visit,Eagles Landing High School,301 Tunis Rd,
537,2017-10-03,GA,Mcdonough,Union Grove HS Visit,Union Grove High School,120 E Lake Rd,
538,2017-10-03,GA,Stockbridge,Woodland High School Visit,Woodland High School,800 Moseley Dr,
539,2017-10-03,GA,Thomasville,Brookwood School,Brookwood School,301 Cardinal Ridge Rd,
540,2017-10-03,GA,Thomasville,Thomas County Central High School,Thomas County Central High School,4686 US Highway 84 Byp W,
541,2017-10-03,GA,Thomasville,Thomasville High School,Thomasville High School,315 S Hansell St,
542,2017-10-03,NC,Greensboro,CACRAO - Guilford County Schools,Greensboro Coliseum Complex,1921 W Gate City Blvd,
543,2017-10-03,NC,Greensboro,Greensboro Day School,Greensboro Day School,5401 Lawndale Dr,
544,2017-10-03,NC,Greensboro,Grimsley High School,Grimsley High School,801 Westover Ter,
545,2017-10-03,NC,Greensboro,Page High School,Walter Hines Page High School,201 Alma Pinnix Dr,
546,2017-10-03,NJ,Farmingdale,Howell High School,Howell High School,405 Squankum Yellowbrook Rd,
547,2017-10-03,NJ,Manasquan,Manasquan High School's Post High School Education Night,Manasquan High School,167 Broad St,
548,2017-10-03,NJ,Middletown,Middletown High School South,Middletown High School South,900 Nutswamp Rd,
549,2017-10-03,NJ,Rumson,Rumson-Fair Haven High School,Rumson-Fair Haven Regional High School,74 Ridge Rd,
550,2017-10-03,TN,Knoxville,Farragut High School College Night,Farragut High School,11237 Kingston Pike,
551,2017-10-03,TX,Cypress,Cypress-Fairbanks ISD College Night @ Berry Center,Richard E Berry Center,8877 Barker Cypress Rd,
552,2017-10-03,TX,Houston,Lamar High School College Night,Mirabeau B Lamar Sr High Sch,3325 Westheimer Rd,
553,2017-10-03,VA,Mclean,Madeira School,Madeira School The,8328 Georgetown Pike,
554,2017-10-03,VA,Mclean,The Potomac School,Potomac School,1301 Potomac School Rd,
555,2017-10-04,CA,La Canada,St. Francis High School's Annual College Fair,Saint Francis High School,200 Foothill Blvd,
556,2017-10-04,CA,Los Angeles,Loyola High School RACC Mini Fair,Loyola High School,1901 Venice Blvd,
557,2017-10-04,DC,Washington,Mini College Fair at Georgetown Day School,Georgetown Day School,4200 Davenport St NW,1.0
558,2017-10-04,FL,Lakewood Rch,Out Of Door Academy,Out Of Door Academy High Sch,5950 Deer Dr,
559,2017-10-04,FL,Osprey,Pine View School,Pine View School,1 Python Path,1.0
560,2017-10-04,FL,Sarasota,Riverview High School,Riverview High School,1 Ram Way,
561,2017-10-04,GA,Atlanta,Ben Franklin Academy,Ben Franklin Academy,1585 Clifton Rd NE,
562,2017-10-04,GA,Atlanta,Booker T. Washington,Booker T Washington HS,45 Whitehouse Dr SW,1.0
563,2017-10-04,GA,Atlanta,Holy Spirit Preparatory School,Holy Spirit Preparatory School,4465 Northside Dr NW,
564,2017-10-04,GA,Atlanta,Maynard Holbrook Jackson HS,Maynard Holbrook Jackson High School,801 Glenwood Ave SE,
565,2017-10-04,GA,Atlanta,South Atlanta High School,South Atlanta High School,800 Hutchens Rd SE,
566,2017-10-04,GA,Bainbridge,Grace Christian Academy,Grace Christian Academy,1302 Lake Douglas Rd,
567,2017-10-04,GA,Cairo,Cairo High School,Cairo High School,455 5th St SE,
568,2017-10-04,GA,Donalsonville,Seminole County Middle/High School,Seminole Cty Middle/HS,5582 Highway 39,
569,2017-10-04,GA,Marietta,Lassiter High School,Lassiter High School,2601 Shallowford Rd,
570,2017-10-04,MD,Baltimore,Mount de Sales Academy & Mount Saint Joseph High School College Fair,Mount Saint Joseph High School,4403 Frederick Ave,
571,2017-10-04,NC,Charlotte,Charlotte Latin School,Charlotte Latin School,9502 Providence Rd,
572,2017-10-04,NC,Charlotte,Providence Day School,Providence Day School,5800 Sardis Rd,
573,2017-10-04,NC,Charlotte,Providence High School,Providence High School,1800 Pineville Matthews Rd,
574,2017-10-04,NC,Matthews,Weddington High School,Weddington High School,4901 Weddington Rd,
575,2017-10-04,NJ,Lincroft,Christian Brothers Academy,Christian Brothers Academy,850 Newman Springs Rd,
576,2017-10-04,NJ,Middletown,Mater Dei Prep High School,Mater Dei Prep,538 Church St,
577,2017-10-04,NJ,Rumson,"Evening with UGA - Rumson, NJ",Rumson-Fair Haven Regional High School,74 Ridge Rd,
578,2017-10-04,TN,Knoxville,Webb School College Fair,Webb School Of Knoxville,9800 Webb School Ln,
579,2017-10-04,TX,Richmond,Fort Bend ISD College Night @ Travis High School,William B Travis High School,11111 Harlem Rd,
580,2017-10-05,CA,Rsm,Santa Margarita Catholic High School Annual College Fair,Santa Margarita Catholic HS,22062 Antonio Pkwy,
581,2017-10-05,CA,Santa Ana,Nova Academy College & Career Fair,Nova Academy Early College HS,2609 W 5th St,
582,2017-10-05,FL,Naples,Barron Collier High School,Barron Collier High School,5600 Cougar Dr,
583,2017-10-05,FL,Naples,Community School of Naples,Community School Of Naples,13275 Livingston Rd,
584,2017-10-05,GA,Atlanta,Best Academy/Coretta Scott King Women's Leadership Academy,Coretta Scott King Womens High School,1190 Northwest Dr NW,
585,2017-10-05,GA,Atlanta,Carver High School/Carver Early College Visit,Carver High School,55 Mcdonough Blvd SE,
586,2017-10-05,GA,Atlanta,Frederick Douglass High School,Frederick Douglass High School,225 Hamilton E Holmes Dr NW,
587,2017-10-05,GA,Bainbridge,Bainbridge High School,Bainbridge High School,1 Bearcat Blvd,
588,2017-10-05,GA,Camilla,Westwood School,Westwood School,PO Box 528,
589,2017-10-05,MD,Severna Park,Severn School,Severn School,201 Water St,
590,2017-10-05,MD,Severna Park,Severna Park HS,Severna Park Senior HS,60 Robinson Rd,
591,2017-10-05,NC,Charlotte,CACRAO - Charlotte: Mecklenburg County Schools,Charlotte Convention Center,501 S College St,
592,2017-10-05,NJ,Basking Ridge,Ridge High School,Ridge High School,268 S Finley Ave,
593,2017-10-05,NJ,Little Silver,Red Bank Regional High School,Red Bank Regional High School,101 Ridge Rd,
594,2017-10-05,NJ,West Orange,Seton Hall Preparatory School's College Representatives Night,Seton Hall Preparatory School,120 Northfield Ave,
595,2017-10-06,FL,Jacksonville,Episcopal School of Jacksonville,Episcopal School of Jacksonville,4455 Atlantic Blvd,
596,2017-10-06,GA,Atlanta,The Westminster Schools,The Westminster Schools,1424 W Paces Ferry Rd NW,
597,2017-10-06,GA,Blakely,Early County High School College Fair,Early County High School,12020 Columbia St,
598,2017-10-06,GA,College Park,Woodward Academy,Woodward Academy,1662 Rugby Ave,
599,2017-10-06,GA,Damascus,Southwest Georgia Academy,Southwest Georgia Academy,14105 Ga Highway 200,
600,2017-10-06,GA,Norcross,Greater Atlanta Christian School,Greater Atlanta Christian School,1575 Indian Trail Rd,
601,2017-10-06,NJ,Bridgewater,Bridgewater-Raritan Regional HS,Bridgewater-Raritan Rgnl HS,600 Garretson Rd,
602,2017-10-06,NJ,Summit,Summit High School,Summit High School,125 Kent Place Blvd,
603,2017-10-06,NJ,Westfield,Westfield High School,Westfield High School,550 Dorian Rd,
604,2017-10-09,CA,Malibu,Malibu High School,Malibu High School,30215 Morning View Dr,
605,2017-10-09,CA,Pacific Plsds,Palisades High School College Fair,Palisades Charter High School,15777 Bowdoin St,
606,2017-10-09,CA,Santa Monica,Santa Monica High School,Santa Monica High School,601 Pico Blvd,
607,2017-10-09,FL,Windermere,Windermere Preparatory School,Windermere Preparatory School,6189 Winter Garden Vineland Rd,
608,2017-10-09,FL,Winter Garden,West Orange High School,West Orange High School,1625 Beulah Rd,
609,2017-10-09,FL,Winter Park,Trinity Preparatory School,Trinity Preparatory School,5700 Trinity Prep Ln,
610,2017-10-09,GA,Atlanta,Atlanta International School,Atlanta International School,2890 N Fulton Dr NE,
611,2017-10-09,GA,Atlanta,Galloway School,Galloway School,215 W Wieuca Rd NW,
612,2017-10-09,GA,Atlanta,Paideia School,Paideia School,1509 Ponce De Leon Ave NE,
613,2017-10-09,GA,Statesboro,Statesboro High School,Statesboro High School,10 Lester Rd,
614,2017-10-09,KY,Louisville,Sacred Heart Academy,Sacred Heart Academy,3175 Lexington Rd,
615,2017-10-09,MD,Kensington,Albert Einstein High School's 18th Annual College Fair,Albert Einstein High School,11135 Newport Mill Rd,
616,2017-10-09,NJ,Hillsborough,Hillsborough High School,Hillsborough High School,466 Raider Blvd,
617,2017-10-09,NJ,Monmouth Jct,South Brunswick High School,South Brunswick High School,750 Ridge Rd,
618,2017-10-09,NJ,Monroe Twp,Monroe Township High School,Monroe Township High School,200 Schoolhouse Rd,
619,2017-10-09,SC,Hartsville,South Carolina Governor's School for Science and Mathematics,Governor School Science,401 Railroad Ave,1.0
620,2017-10-09,TX,Houston,Westside High School College Fair,Westside High School,14201 Briar Forest Dr,
621,2017-10-10,CA,Los Angeles,Immaculate Heart High School,Immaculate Heart High School,5515 Franklin Ave,
622,2017-10-10,CA,Los Angeles,Marlborough High School,Marlborough School,250 S Rossmore Ave,
623,2017-10-10,CA,Rosemead,Don Bosco Technical Institute College Fair,Don Bosco Technical Institute,1151 San Gabriel Blvd,
624,2017-10-10,FL,Orlando,Bishop Moore High School,Bishop Moore High School,3901 Edgewater Dr,
625,2017-10-10,FL,Orlando,Lake Highland Preparatory School,Lake Highland Preparatory Scho,901 Highland Ave,1.0
626,2017-10-10,FL,Orlando,William R Boone High School,William R Boone High School,1000 E Kaley St,
627,2017-10-10,FL,Winter Park,Winter Park High School,Winter Park High School,2100 Summerfield Rd,
628,2017-10-10,GA,Alpharetta,PROBE Atlanta North Fair at North Point Mall,North Point Mall,1000 N Point Cir,
629,2017-10-10,GA,Dunwoody,Dunwoody High School,Dunwoody High School,5035 Vermack Rd,
630,2017-10-10,GA,Jefferson,Jackson County Comprehensive High School,Jackson County Comprehensive High School,1668 Winder Hwy,
631,2017-10-10,GA,Sandersville,Brentwood School,Brentwood School,725 Linton Rd,
632,2017-10-10,GA,Sandy Springs,Riverwood International Charter,Riverwood International Charter School,5900 Raider Dr,
633,2017-10-10,GA,Statesboro,Bulloch Academy,Bulloch Academy,873 Westside Rd,1.0
634,2017-10-10,NJ,Allendale,Northern Highlands Regional HS,Northern Highlands Regional HS,298 Hillside Ave,
635,2017-10-10,NJ,Millburn,Millburn High School,Millburn High School,462 Millburn Ave,
636,2017-10-10,NJ,Morristown,"Evening with UGA - Morristown, NJ",Morristown High School,50 Early St,
637,2017-10-10,NJ,Randolph,Randolph High School,Randolph High School,511 Millbrook Ave,
638,2017-10-10,TX,Houston,Emory Weiner High School Visit,Emery Weiner School,9825 Stella Link Rd,
639,2017-10-10,TX,Houston,Memorial Senior High School Visit,Memorial Senior High School,935 Echo Ln,
640,2017-10-10,TX,Houston,Spring Branch ISD College Night,Spring Woods Senior HS,2045 Gessner Rd,
641,2017-10-10,VA,Fairfax,"VACRAO - George Mason University, Northern Virginia College Fair",George Mason University,4500 Patriot Circle,
642,2017-10-11,CA,Brea,Brea Olinda High School,Brea Olinda High School,789 Wildcat Way,
643,2017-10-11,CA,Corona,Santiago High School College Fair,Santiago High School,1395 Foothill Pkwy,
644,2017-10-11,CA,Placentia,El Dorado High School,El Dorado High School,1651 Valencia Ave,
645,2017-10-11,FL,Saint Johns,Creekside High School,Creekside High School,100 Knights Ln,
646,2017-10-11,TX,Katy,Katy ISD College and Career Night,Leonard E. Merrell Center,6301 S Stadium Ln,
647,2017-10-11,TX,Missouri City,Elkins High School Visit,Elkins High School,7007 Knights Ct,
648,2017-10-11,VA,Alexandria,VACRAO - Episcopal High School College Fair,Episcopal High School,1200 N Quaker Ln,
649,2017-10-12,CA,Newport Beach,Newport Harbor High School,Newport Harbor High School,600 Irvine Ave,
650,2017-10-12,CA,Riverside,Martin Luther King High School,Martin Luther King High School,9301 Wood Rd,
651,2017-10-12,CA,San Juan Capo,JSerra Catholic High School Annual College Fair,Jserra Catholic High School,26351 Junipero Serra Rd,
652,2017-10-12,CO,Aurora,Regis Jesuit High School Boys,Regis Jesuit High School Boys,6400 S Lewiston Way,
653,2017-10-12,CO,Greenwood Vlg,Cherry Creek High School,Cherry Creek High School,9300 E Union Ave,
654,2017-10-12,FL,Jacksonville,Stanton College Preparatory School,Stanton College Prep School,1149 W 13th St,
655,2017-10-12,FL,Jacksonville,The Bolles School,The Bolles School,7400 San Jose Blvd,
656,2017-10-12,FL,Orange Park,Saint Johns Country Day School,Saint Johns Country Day School,3100 Doctors Lake Dr,
657,2017-10-12,FL,Ponte Vedra,Ponte Vedra High School,Ponte Vedra High School,460 Davis Park Rd,
658,2017-10-12,GA,Cumming,Pinecrest Academy,Pinecrest Academy,955 Peachtree Pwky,
659,2017-10-12,GA,Cumming,PROBE Forsyth County Fair at Lanier Tech Conference Center,Forsyth Conference Center at Lanier Technical College,3410 Ronald Reagan Blvd,
660,2017-10-12,GA,Mableton,Whitefield Academy,Whitefield Academy,1 Whitefield Dr SE,
661,2017-10-12,GA,Marietta,PROBE Cobb County Fair at Marietta High School,Marietta High School,1171 Whitlock Ave SW,
662,2017-10-12,GA,Suwanee,Lambert High School,Lambert High School,805 Nichols Rd,
663,2017-10-12,IL,Highland Park,Highland Park High School,Highland Park High School,433 Vine Ave,
664,2017-10-12,IL,Lincolnshire,Adlai Stevenson High School,Adlai E Stevenson High School,1 Stevenson Dr,
665,2017-10-12,IL,Mt Prospect,Mt. Prospect High School,Prospect High School,801 W Kensington Rd,
666,2017-10-12,TX,Bellaire,Houston ISD College Fair @ Bellaire High School,Bellaire Senior High School,5100 Maple St,
667,2017-10-12,TX,Houston,Duchesne High School Visit,Duchesne Academy Sacred Heart,10202 Memorial Dr,
668,2017-10-12,TX,Houston,Houston Catholic High Schools 2017 College Fair,Strake Jesuit College Prep,8900 Bellaire Blvd,
669,2017-10-12,TX,Sugar Land,Clements High School Visit,William P Clements High School,4200 Elkins Rd,
670,2017-10-12,VA,Alexandria,St. Stephens and St Agnes,St Stephens and St Agnes School,1000 Saint Stephens Rd,
671,2017-10-12,VA,Alexandria,TC Williams High School,T C Williams High School,3330 King St,
672,2017-10-13,FL,Ponte Vedra,Allen D Nease High School,Allen D Nease High School,10550 Ray Rd,
673,2017-10-13,FL,Saint Johns,Bartram Trail High School,Bartram Trail High School,7399 Longleaf Pine Pkwy,
674,2017-10-13,FL,St Augustine,St. Joseph Academy,Saint Joseph Academy,155 State Road 207,
675,2017-10-13,IL,Hinsdale,Hinsdale High School,Hinsdale Central High School,55th And Grant  Rm #113,
676,2017-10-13,IL,La Grange,Lyons Township High School,Lyons Township High School,100 S Brainard Ave,
677,2017-10-13,IL,Palatine,WM Fremd High School,William Fremd High School,1000 S Quentin Rd,
678,2017-10-14,FL,Jacksonville,NACAC Jacksonville National College Fair,Prime F. Osborn III Convention Center,1000 Water St,
679,2017-10-14,IL,Chicago,NACAC Chicago National College Fair,McCormick Place,2301 S King Dr,
680,2017-10-15,CA,El Segundo,Vistamar School Multicultural Student College Fair,Vistamar School,737 Hawaii St,
681,2017-10-15,FL,Miami,AIMS (Association of Independent Miami Schools) College Fair,Hilton Miami Airport Hotel,5101 Blue Lagoon Dr,
682,2017-10-15,VA,Fairfax,VACRAO - Fairfax County College Fair,Fair Oaks Mall,11750 Fair Oaks Mall,
683,2017-10-16,CA,Anaheim,Tri-School College Night: Servite - Rosary - Connelly,Servite High School,1952 W La Palma Ave,
684,2017-10-16,DE,Claymont,Archmere Academy,Archmere Academy,3600 Philadelphia Pike,
685,2017-10-16,FL,Davie,Nova High School,Nova High School,3600 College Ave,
686,2017-10-16,FL,Ft Lauderdale,Pine Crest Invitational College Fair,Pine Crest School,1501 NE 62nd St,
687,2017-10-16,FL,Parkland,Marjory Stoneman Douglas High School,Marjory Stoneman Douglas HS,5901 Pine Island Rd,
688,2017-10-16,GA,Atlanta,Atlanta Jewish Academy,Atlanta Jewish Academy,3130 Raymond Dr,
689,2017-10-16,GA,Atlanta,Lakeside High School's 2017 Fall College Fair,Lakeside High School,3801 Briarcliff Rd NE,
690,2017-10-16,GA,Decatur,Decatur High School,Decatur High School,310 N Mcdonough St,
691,2017-10-16,NV,Las Vegas,Bishop Gorman High School Annual College Fair,Bishop Gorman High School,5959 S Hualapai Way,
692,2017-10-16,VA,Alexandria,VACRAO - Fairfax County College Night,Hayfield Secondary School,7630 Telegraph Rd,
693,2017-10-17,CA,Huntingtn Bch,Huntington Beach High School,Huntington Beach High School,1905 Main St,
694,2017-10-17,CA,Newport Beach,Corona Del Mar High School RACC Mini Fair,Corona Del Mar High School,2101 Eastbluff Dr,
695,2017-10-17,CA,Newport Beach,Pacifica Christian Orange County High School,Pacifica Christian HS - Orange County,883 W 15th St,1.0
696,2017-10-17,FL,Boca Raton,Spanish River Community High School,Spanish River Community HS,5100 Jog Rd,
697,2017-10-17,FL,Davie,NSU University School,University School Of Nsu,3375 SW 75th Ave,
698,2017-10-17,FL,Plantation,"American Heritage School (Plantation, FL)",American Heritage School,12200 W Broward Blvd,1.0
699,2017-10-17,FL,Riviera Beach,Suncoast Community High School's 7th Annual College Fair,Suncoast Community High School,1717 Avenue S,
700,2017-10-17,GA,Augusta,Westminster Schools Of Augusta,Westminster Schools Of Augusta,3067 Wheeler Rd,
701,2017-10-17,GA,Bogart,North Oconee High School Dual Enrollment Parent Night,North Oconee High School,1081 Rocky Branch Rd,
702,2017-10-17,GA,Commerce,East Jackson Comprehensive High School,East Jackson Comprehensive High School,1435 Hoods Mill Rd,
703,2017-10-17,GA,Evans,Greenbrier High School,Greenbrier High School,5114 Riverwood Pkwy,
704,2017-10-17,GA,Grovetown,Grovetown High School,Grovetown High School,2010 Warrior Way,
705,2017-10-17,GA,Harlem,Harlem High School,Harlem High School,1070 Appling Harlem Rd,
706,2017-10-17,GA,Winder,Apalachee High School,Apalachee High School,940 Haymon Morris Rd,
707,2017-10-17,OH,Mason,Mason High School College Visit Night,William Mason High School,6100 S Mason Montgomery Rd,
708,2017-10-18,CA,Costa Mesa,Newport-Mesa Unified School District's College & Career Night,OC Fair & Event Center,88 Fair Dr,
709,2017-10-18,CA,Mission Viejo,Trabuco Hills High School,Trabuco Hills High School,27501 Mustang Run,
710,2017-10-18,CA,Rcho Sta Marg,Tesoro High School RACC Mini Fair,Tesoro High School,1 Tesoro Creek Rd,
711,2017-10-18,FL,West Palm Bch,Oxbridge Academy,Oxbridge Academy-Palm Beaches,3151 N Military Trl,1.0
712,2017-10-18,GA,Atlanta,The Weber School,The Weber School,6751 Roswell Rd,
713,2017-10-18,GA,Greensboro,Lake Oconee Academy Junior/Senior College & Career Parent Night,Lake Oconee Academy,1021 Titan Cir,1.0
714,2017-10-18,GA,Johns Creek,Chattahoochee High School,Chattahoochee High School,5230 Taylor Rd,
715,2017-10-18,GA,Savannah,Herschel Jenkins High School,Herschel Jenkins High School,1800 E De Renne Ave,
716,2017-10-18,GA,Savannah,PROBE Savannah Fair at Oglethorpe Mall,Oglethorpe Mall,7804 Abercorn St,
717,2017-10-18,GA,Savannah,Savannah Arts Academy,Savannah Arts Academy,500 Washington Ave,
718,2017-10-18,GA,Savannah,Sol C Johnson High School,Sol C Johnson High School,3012 Sunset Blvd,
719,2017-10-18,OH,Blue Ash,Ursuline Academy,Ursuline Academy,5535 Pfeiffer Rd,
720,2017-10-18,OH,Cincinnati,Cincinnati Hills Christian Academy,Cincinnati Hills Chrstn Acad,11525 Snider Rd,
721,2017-10-18,OH,Cincinnati,Indian Hill High School,Indian Hill High School,6845 Drake Rd,
722,2017-10-18,OH,Loveland,Loveland,Loveland High School,1 Tiger Trl,
723,2017-10-18,PA,Gibsonia,Pine-Richland High School,Pine-Richland High School,700 Warrendale Rd,
724,2017-10-18,VA,Fredericksbrg,VACRAO - King George High School College Fair,Spotsylvania Towne Centre,137 Spotsylvania Mall,
725,2017-10-19,CA,San Diego,Canyon Crest Academy,Canyon Crest Academy,5951 E Village Center Loop Rd,
726,2017-10-19,CA,San Diego,Cathedral Catholic College Fair,Cathedral Catholic H S,5555 Del Mar Heights Rd,
727,2017-10-19,CA,San Diego,Del Norte High School,Del Norte High School,16601 Night Hawk Ln,
728,2017-10-19,CA,San Diego,Rancho Bernardo High School,Rancho Bernardo High School,13010 Paseo Lucido,
729,2017-10-19,CA,Solana Beach,Santa Fe Christian School,Santa Fe Christian School,838 Academy Dr,
730,2017-10-19,GA,Flowery Br,Flowery Branch High School,Flowery Branch High School,6603 Spout Springs Rd,
731,2017-10-19,GA,Guyton,South Effingham High School,South Effingham High School,1220 Noel C Conaway Rd,
732,2017-10-19,GA,Savannah,Savannah Christian Prep Sch,Savannah Christian Prep Sch,1599 Chatham Pkwy,
733,2017-10-19,GA,Springfield,Effingham County High School,Effingham County High School,1589 Highway 119 S,
734,2017-10-19,OH,Columbus,Bishop Watterson High School,Bishop Watterson High School,99 E Cooke Rd,
735,2017-10-19,OH,Dublin,Dublin Jerome High School,Dublin Jerome High School,8300 Hyland Croy Rd,
736,2017-10-19,OH,New Albany,New Albany High School,New Albany High School,7600 Fodor Rd,
737,2017-10-19,OH,Upper Arlngtn,Upper Arlington High School,Upper Arlington High School,1650 Ridgeview Rd,
738,2017-10-19,TN,Chattanooga,Baylor School,Baylor School,171 Baylor School Rd,
739,2017-10-19,TN,Chattanooga,Chattanooga Christian School Mini-Fair,Chattanooga Christian School,3354 Charger Dr,
740,2017-10-19,TN,Chattanooga,Notre Dame High School,Notre Dame High School,2701 Vermont Ave,
741,2017-10-19,TN,Ooltewah,East Hamilton High School,East Hamilton School,2015 Ooltewah Ringgold Rd,
742,2017-10-20,CA,Carlsbad,La Costa Canyon High School,La Costa Canyon High School,1 Maverick Way,
743,2017-10-20,CA,Carlsbad,Sage Creek High School Visit,Sage Creek High School,3900 Cannon Rd,1.0
744,2017-10-20,CA,San Diego,Torrey Pines High School,Torrey Pines High School,3710 Del Mar Heights Rd,
745,2017-10-20,GA,Atlanta,Druid Hills High School College Fair,Druid Hills High School,1798 Haygood Dr NE,
746,2017-10-20,OH,Chagrin Falls,Chagrin Falls High School,Chagrin Falls High School,400 E Washington St,
747,2017-10-20,OH,Hudson,Hudson High School,Hudson High School,2500 Hudson Aurora Rd,
748,2017-10-20,OH,Kent,Theodore Roosevelt High School,Theodore Roosevelt High School,1400 N Mantua St,
749,2017-10-20,OH,Solon,Solon High School,Solon High School,33600 Inwood Dr,
750,2017-10-21,CA,San Diego,Explore Solutions' Fall College Showcase,Town and Country San Diego,500 Hotel Cir N,
751,2017-10-22,OH,Cincinnati,NACAC Cincinnati National College Fair,Duke Energy Convention Center,525 Elm St,
752,2017-10-23,GA,Atlanta,"UCAAN Information Session in Atlanta with UChicago, Purdue, Georgia Tech, and UGA",Ferst Center For The Arts,350 Ferst Drive Northwest,
753,2017-10-23,TX,Haslet,2017 Northwest ISD College and Career Fair,V.R. Eaton High School,1350 Eagle Blvd,
754,2017-10-23,VA,Chesapeake,Chesapeake Public Schools Annual College Fair,Indian River High School,1969 Braves Trl,
